{
  "name": "mimesis-engineering",
  "version": "0.1.0",
  "status": "public-working-framework-v0.1",
  "purpose": "AI-native work framework for improving one weak artifact through standards, references, and proof boundaries.",
  "corePhrases": [
    "Give AI standards, not roles.",
    "Bring one weak artifact.",
    "No proof, no claim."
  ],
  "loop": [
    "Import",
    "Distill",
    "Capsule",
    "Shard",
    "Verify",
    "Remember"
  ],
  "aiNativeShape": {
    "primaryUse": "Give agents explicit artifact standards, source boundaries, case files, and validation commands.",
    "humanInput": "one weak artifact plus constraints",
    "agentOutput": "a stronger artifact, seven protocol files, and a visible proof boundary",
    "memoryRule": "Remember only through explicit run ledger and case notes, not hidden claims."
  },
  "entrypoints": [
    {
      "name": "30-second orientation",
      "path": "README.md",
      "command": null
    },
    {
      "name": "5-minute first loop",
      "path": "docs/QUICKSTART.md",
      "command": "npm run first-loop:demo"
    },
    {
      "name": "framework spec",
      "path": "spec/mimesis-v0.1.md",
      "command": null
    },
    {
      "name": "spec index",
      "path": "spec/README.md",
      "command": "npm run audit:spec-index"
    },
    {
      "name": ".mimesis file protocol",
      "path": "spec/file-protocol.md",
      "command": "npm run validate"
    },
    {
      "name": "proof boundary",
      "path": "PROOF-BOUNDARY.md",
      "command": null
    },
    {
      "name": "machine-readable manifest",
      "path": ".mimesis/framework-manifest.json",
      "command": "npm run framework:manifest"
    },
    {
      "name": "source-first reference pack index",
      "path": ".mimesis/reference-packs/index.json",
      "command": "npm run reference:index"
    },
    {
      "name": "Superpowers adapter",
      "path": ".mimesis/adapter-packets/superpowers.md",
      "command": "npm run adapter:superpowers"
    },
    {
      "name": "proof intake schema",
      "path": "spec/proof-intake.schema.json",
      "command": "npm run audit:proof-intake-schema"
    },
    {
      "name": "proof intake fixture record",
      "path": ".mimesis/proof-intake/fixture-record.json",
      "command": "npm run proof:intake-record"
    },
    {
      "name": "proof intake check report",
      "path": ".mimesis/proof-intake/fixture-check.md",
      "command": "npm run proof:intake-check"
    },
    {
      "name": "proof intake from owner evidence bridge",
      "path": ".mimesis/proof-intake/from-owner-evidence-bridge.md",
      "command": "npm run proof:intake-from-owner-evidence"
    },
    {
      "name": "proof redaction packet",
      "path": ".mimesis/proof-intake/redaction-packet.md",
      "command": "npm run proof:redaction-packet"
    },
    {
      "name": "proof submission packet",
      "path": ".mimesis/proof-intake/submission-packet.md",
      "command": "npm run proof:submission-packet"
    },
    {
      "name": "proof acceptance packet",
      "path": ".mimesis/proof-intake/acceptance-packet.md",
      "command": "npm run proof:acceptance-packet"
    },
    {
      "name": "proof execution report",
      "path": ".mimesis/proof-runs/execution-report.md",
      "command": "npm run proof:execution-report"
    },
    {
      "name": "proof execution record schema",
      "path": "spec/proof-execution-record.schema.json",
      "command": "npm run audit:proof-execution-report"
    },
    {
      "name": "first weak artifact readiness",
      "path": ".mimesis/proof-runs/readiness.md",
      "command": "npm run proof:readiness"
    },
    {
      "name": "first proof candidate packet",
      "path": ".mimesis/proof-candidates/first-candidate.md",
      "command": "npm run proof:candidate-packet"
    },
    {
      "name": "current gap register",
      "path": ".mimesis/gaps/current-gap-register.json",
      "command": "npm run gap:register"
    },
    {
      "name": "gap closure plan",
      "path": ".mimesis/gaps/closure-plan.json",
      "command": "npm run gap:closure-plan"
    },
    {
      "name": "gate evidence packet",
      "path": ".mimesis/gates/evidence-packet.md",
      "command": "npm run gate:evidence-packet"
    },
    {
      "name": "gate closure readiness report",
      "path": ".mimesis/gates/closure-readiness.json",
      "command": "npm run gate:closure-readiness"
    },
    {
      "name": "gate closure review record",
      "path": ".mimesis/gates/closure-review.json",
      "command": "npm run gate:closure-review"
    },
    {
      "name": "case from proof intake record",
      "path": "docs/CASE-FROM-RECORD.md",
      "command": "npm run cli -- case:from-record .mimesis/proof-intake/fixture-record.json"
    },
    {
      "name": "evidence from completed case",
      "path": "docs/EVIDENCE-FROM-CASE.md",
      "command": "npm run cli -- evidence:from-case . --out .mimesis/evidence-packets/local-case-draft.md --force"
    },
    {
      "name": "evidence review",
      "path": "docs/EVIDENCE-REVIEW.md",
      "command": "npm run cli -- evidence:review path/to/evidence-packet.md --decision reviewed --reviewer \"Reviewer Name\" --note \"Reviewed against the proof boundary.\" --out path/to/reviewed-evidence.md"
    },
    {
      "name": "claim from reviewed evidence",
      "path": "docs/CLAIM-FROM-EVIDENCE.md",
      "command": "npm run cli -- claim:from-evidence path/to/reviewed-evidence.md --out path/to/claim-candidate.md"
    },
    {
      "name": "local Codex plugin install readiness",
      "path": ".mimesis/plugin-install-packets/codex-local.md",
      "command": "npm run plugin:install-packet"
    },
    {
      "name": "owner release decision record",
      "path": ".mimesis/release-decisions/owner-decision-record.json",
      "command": "npm run release:decision-record"
    },
    {
      "name": "license decision from owner answer bridge",
      "path": ".mimesis/release-decisions/from-owner-answer-bridge.md",
      "command": "npm run license:decision-from-owner-answer"
    },
    {
      "name": "release evidence report",
      "path": ".mimesis/release-evidence/v0.1-report.md",
      "command": "npm run release:evidence-report"
    },
    {
      "name": "publication evidence intake",
      "path": ".mimesis/release-evidence/publication-evidence-packet.md",
      "command": "npm run publication:evidence-packet"
    },
    {
      "name": "external adoption evidence intake",
      "path": ".mimesis/adoption-packets/v0.2-first-adoption.md",
      "command": "npm run adoption:packet"
    },
    {
      "name": "owner action queue",
      "path": ".mimesis/owner-actions/current-action-queue.md",
      "command": "npm run owner:queue"
    },
    {
      "name": "owner issue queue",
      "path": ".mimesis/owner-actions/v0.2-issue-queue.md",
      "command": "npm run owner:issue-queue"
    },
    {
      "name": "owner issue remote sync",
      "path": ".mimesis/owner-actions/remote-issue-sync.json",
      "command": "npm run owner:issue-remote-sync"
    },
    {
      "name": "owner proof handoff",
      "path": ".mimesis/owner-actions/proof-run-handoff.md",
      "command": "npm run owner:proof-handoff"
    },
    {
      "name": "owner proof input template",
      "path": ".mimesis/owner-actions/proof-input-template.json",
      "command": "npm run owner:proof-input-template"
    },
    {
      "name": "owner proof input issue packet",
      "path": ".mimesis/owner-actions/proof-input-issue-packet.md",
      "command": "npm run owner:proof-input-issue"
    },
    {
      "name": "owner proof input request packet",
      "path": ".mimesis/owner-actions/proof-input-request.md",
      "command": "npm run owner:proof-input-request"
    },
    {
      "name": "owner proof input remote issue anchor",
      "path": ".mimesis/owner-actions/remote-proof-input-issue-anchor.md",
      "command": "npm run owner:proof-input-remote-issue"
    },
    {
      "name": "owner proof input remote issue snapshot",
      "path": ".mimesis/owner-actions/remote-proof-input-issue-snapshot.json",
      "command": "npm run owner:proof-input-remote-issue-snapshot"
    },
    {
      "name": "owner proof input issue converted fixture",
      "path": ".mimesis/owner-actions/fixture-owner-proof-input-issue-record.json",
      "command": "npm run owner:proof-input-issue-convert"
    },
    {
      "name": "owner proof input review report",
      "path": ".mimesis/owner-actions/fixture-proof-input-review.md",
      "command": "npm run owner:proof-input-review"
    },
    {
      "name": "owner proof input split report",
      "path": ".mimesis/owner-actions/proof-input-split-report.md",
      "command": "npm run owner:proof-input-split"
    },
    {
      "name": "owner decision intake",
      "path": ".mimesis/owner-actions/decision-intake.md",
      "command": "npm run owner:decision-intake"
    },
    {
      "name": "owner decision answer record",
      "path": ".mimesis/owner-actions/fixture-answer-record.json",
      "command": "npm run owner:decision-answer-record"
    },
    {
      "name": "owner answer review",
      "path": ".mimesis/owner-actions/answer-review.md",
      "command": "npm run owner:answer-review"
    },
    {
      "name": "owner evidence bundle",
      "path": ".mimesis/owner-actions/evidence-bundle.md",
      "command": "npm run owner:evidence-bundle"
    },
    {
      "name": "owner evidence intake record",
      "path": ".mimesis/owner-actions/fixture-evidence-record.json",
      "command": "npm run owner:evidence-intake-record"
    },
    {
      "name": "owner evidence review",
      "path": ".mimesis/owner-actions/evidence-review.md",
      "command": "npm run owner:evidence-review"
    },
    {
      "name": "owner evidence attachment form",
      "path": ".mimesis/owner-actions/evidence-attachment-form.md",
      "command": "npm run owner:evidence-attachment-form"
    },
    {